### ISSUE TITLE
Spring Boot 3.x Micrometer StatsD registry does not send metrics to UDP port when another StatsD client is active on the same port

### ISSUE THREAD

**Issue by spachari-im** [micrometer-metrics/micrometer#5313]
**Describe the bug**
In Spring Boot 3.x, Micrometer's inbuilt StatsD agent does not report JMX metrics when another StatsDClient is created to send custom metrics to the same host & port.

**Environment**
Spring Boot 3.2.7, Spring Camel version 4.5.0 application.

 - Micrometer version [1.12.7]
 - Micrometer registry - StatsD [1.9.2]
 - OS: MacOS
 - Java version: 17

**To Reproduce**
How to reproduce the bug:

- Declare a StatsDClient bean to send custom metrics to Datadog
```
StatsDClient statsDClient = new NonBlockingStatsDClientBuilder()
                    .prefix(PREFIX)
                    .hostname(localhost)
                    .port(8125)
                    .build(); 
```
- Add mcrometer-registry-statsd to project (in pom.xml). 
- Enable micrometer statsd metrics.
```
management.statsd.metrics.export.enabled=true
management.statsd.metrics.export.flavor=datadog
management.statsd.metrics.export.protocol=udp
management.statsd.metrics.export.host=localhost
management.statsd.metrics.export.port=8125
management.statsd.metrics.export.polling-frequency=10s
management.statsd.metrics.export.publish-unchanged-meters=true
```
***Note: the Micrometer StatsD client and the custom StatsDClient both send metrics to the same host and port***

- The application does not report the implicit JVM metrics sent by Micrometer to the StatsD Agent to port 8125 (netcat -ulp 8125). 
- Only the custom metrics sent by the Datadog StatsD client is being reported to port 8125.
- When the Datadog StatsD client is removed, the JVM metrics are successfully reported to port 8125. 

**Expected behavior**

- On port 8125 (netcat -ulp 8125) ***both*** the custom metrics sent through Datadog StatsD client and the internal JVM metrics sent by Micormeter should be visible.
- Micrometer should report some warning in logs if metrics cannot be sent to the UDP port, instead of ignoring the metric.

**Additional context**

- This configuration runs successfully on Spring Boot 2.x and Micrometer 1.9.2. 
- When the Datadog StatsD client is removed, the JVM metrics are successfully reported to port 8125. 
- It appears that the Micrometer StatsD agent does not work if there is another StatsD client sending to the same port (I am not sure of this)
- There are no warnings in the logs to give an idea of why this happens.

**Comment by shakuzen** [comment]
Thank you for the report, and sorry for the late triage on it.

> * Micrometer version [1.12.7]
> * Micrometer registry - StatsD [1.9.2]

You should use a single, consistent version of Micrometer. If you are using Spring Boot's dependency management, it should manage the version for you so you don't end up with two different versions like this. Using different versions has potential to cause issues.

I tried to reproduce the issue and I was not able to do so. I added the Dogstatsd client (StatsDClient) to a Spring Boot 3.4.0 app with Micrometer's statsd registry, and all metrics were available in Datadog. Could you please try with the latest versions and ensure consistent versions are used to see if this is still an issue for you?

**Comment by spachari-im** [comment]
@shakuzen thanks for triaging this. 

I did not override the micrometer version. I just specified it in the ticket. The only micrometer dependency in the propject's pom file is this:

```
<dependency>
      <groupId>io.micrometer</groupId>
      <artifactId>micrometer-registry-statsd</artifactId>
    </dependency>
```


I tried this test after upgrading the Spring Boot version to 3.4.0. I get the same behavior - if a StatsD client is added for custom metrics, the custom metrics are reported but JVM metrics are not shown. 

The JVM metrics are shown when the StatsD client is removed.

I think this is because of a setting enabled in the properties file or a dependency related to the Camel starter dependency - `org.apache.camel.springboot`.

Can you please post all the code you have used (properties enabled, bean declaration and pom dependency)?

**Comment by shakuzen** [comment]
Could you start with a minimal project and verify first whether you see the issue there, and then add things like the Camel starter to see if it affects things? The project I used is a bit complicated, but I expect it would work the same in a minimal project, so we need to figure out what in your project is causing the difference.

**Comment by izeye** [comment]
Assuming that @spachari-im was using `netcat` for testing, I could reproduce it with [this sample](https://github.com/izeye/hello-spring-boot-micrometer/tree/micrometer-gh-5313).

From the `netcat` output, I could see metrics only from the `NonBlockingStatsDClient` as follows:

```
% netcat -ulp 8125
prefix.my.counter:1|c
datadog.dogstatsd.client.metrics:1|c|#client:java,client_version:4.4.3,client_transport:udp
datadog.dogstatsd.client.events:0|c|#client:java,client_version:4.4.3,client_transport:udp
datadog.dogstatsd.client.service_checks:0|c|#client:java,client_version:4.4.3,client_transport:udp
datadog.dogstatsd.client.bytes_sent:22|c|#client:java,client_version:4.4.3,client_transport:udp
datadog.dogstatsd.client.bytes_dropped:0|c|#client:java,client_version:4.4.3,client_transport:udp
datadog.dogstatsd.client.packets_sent:1|c|#client:java,client_version:4.4.3,client_transport:udp
datadog.dogstatsd.client.packets_dropped:0|c|#client:java,client_version:4.4.3,client_transport:udp
datadog.dogstatsd.client.packets_dropped_queue:0|c|#client:java,client_version:4.4.3,client_transport:udp
datadog.dogstatsd.client.aggregated_context:0|c|#client:java,client_version:4.4.3,client_transport:udp
datadog.dogstatsd.client.metrics_by_type:0|c|#client:java,client_version:4.4.3,client_transport:udp,metrics_type:gauge
datadog.dogstatsd.cliendatadog.dogstatsd.client.metrics_by_type:0|c|#client:java,client_version:4.4.3,client_transport:udp,metrics_type:distribution
datadog.dogstatsd.client.aggregated_context_by_type:0|c|#client:java,client_version:4.4.3,client_transport:udp,metrics_type:gauge
datadog.dogstatsd.client.aggregated_context_by_type:0|c|#client:java,client_version:4.4.3,client_transport:udp,metrics_type:count
datadog.dogstatsd.client.aggregated_context_by_type:0|c|#client:java,client_version:4.4.3,client_transport:udp,metrics_type:set
prefix.my.counter:1|c
...
```

However, if I use `tcpdump`, I could see metrics from both the `NonBlockingStatsDClient` and the `StatsdMeterRegistry` as follows:

```
% sudo tcpdump udp and dst port 8125 -i lo0 -A
tcpdump: verbose output suppressed, use -v[v]... for full protocol decode
listening on lo0, link-type NULL (BSD loopback), snapshot length 524288 bytes
23:54:31.753601 IP localhost.58535 > localhost.8125: UDP, length 22
E..2....@..................1prefix.my.counter:1|c

23:54:39.731075 IP localhost.55635 > localhost.8125: UDP, length 1359
E..k....@............S...W.kjvm.gc.pause:1|ms|#action:end of minor GC,cause:collect due to normal GC activity,gc:scavenge
jvm.gc.memory.allocated:7196768|c|#statistic:count
logback.events:1|c|#statistic:count,level:info
logback.events:1|c|#statistic:count,level:info
jvm.buffer.memory.used:749717|g|#statistic:value,id:direct
jvm.threads.states:0|g|#statistic:value,state:blocked
jvm.memory.max:429391872|g|#statistic:value,area:heap,id:tenured-LOA
jvm.memory.used:7321936|g|#statistic:value,area:nonheap,id:JIT code cache
jvm.memory.committed:36234240|g|#statistic:value,area:heap,id:tenured-SOA
jvm.memory.max:-1|g|#statistic:value,area:nonheap,id:class storage
jvm.memory.used:1572864|g|#statistic:value,area:heap,id:nursery-survivor
process.uptime:12000|g|#statistic:value
jvm.threads.states:39|g|#statistic:value,state:runnable
system.load.average.1m:4.412109|g|#statistic:value
jvm.memory.used:4194304|g|#statistic:value,area:nonheap,id:JIT data cache
jvm.info:1|g|#statistic:value,runtime:IBM Semeru Runtime Open Edition,vendor:Eclipse OpenJ9,version:17.0.4.1-ea+1
jvm.memory.max:1710707712|g|#statistic:value,area:heap,id:nursery-allocate
tomcat.sessions.active.current:0|g|#statistic:value
disk.total:494384795648|g|#statistic:value,path:/Users/user/IdeaProjects/hello-spring-boot-micrometer/.
executor.queue.remaining:2147483647|g|#statistic:value,name:applicationTaskExecutor

23:54:39.736602 IP localhost.55635 > localhost.8125: UDP, length 1357
E..i.=..@............S...U.ijvm.memory.committed:350734136|g|#statistic:value,area:nonheap,id:class storage
jvm.memory.used:59586816|g|#statistic:value,area:nonheap,id:miscellaneous non-heap storage
jvm.memory.usage.after.gc:0.035527|g|#statistic:value,area:heap,pool:long-lived
tomcat.sessions.expired:0|c|#statistic:count
tomcat.sessions.created:0|c|#statistic:count
jvm.memory.committed:1907712|g|#statistic:value,area:heap,id:tenured-LOA
jvm.memory.committed:6160384|g|#statistic:value,area:heap,id:nursery-allocate
jvm.gc.max.data.size:1710707711|g|#statistic:value
jvm.buffer.total.capacity:0|g|#statistic:value,id:mapped
system.cpu.count:10|g|#statistic:value
jvm.memory.max:8158445568|g|#statistic:value,area:heap,id:tenured-SOA
executor.pool.core:8|g|#statistic:value,name:applicationTaskExecutor
process.start.time:1735397667708|g|#statistic:value
jvm.buffer.count:523|g|#statistic:value,id:direct
jvm.buffer.memory.used:0|g|#statistic:value,id:mapped
jvm.memory.committed:1572864|g|#statistic:value,area:heap,id:nursery-survivor
jvm.memory.used:50772608|g|#statistic:value,area:nonheap,id:class storage
jvm.memory.max:436775936|g|#statistic:value,area:heap,id:nursery-survivor
jvm.threads.daemon:56|g|#statistic:value
process.files.max:122880|g|#statistic:value
jvm.compilation.time:1019|c|#statistic:count,compiler:j9jit29
jvm.threads.states:0|g|#statistic:value,state:new

23:54:39.745809 IP localhost.58535 > localhost.8125: UDP, length 1360
E..l....@................X.ldatadog.dogstatsd.client.metrics:1|c|#client:java,client_version:4.4.3,client_transport:udp
datadog.dogstatsd.client.events:0|c|#client:java,client_version:4.4.3,client_transport:udp
datadog.dogstatsd.client.service_checks:0|c|#client:java,client_version:4.4.3,client_transport:udp
datadog.dogstatsd.client.bytes_sent:22|c|#client:java,client_version:4.4.3,client_transport:udp
datadog.dogstatsd.client.bytes_dropped:0|c|#client:java,client_version:4.4.3,client_transport:udp
datadog.dogstatsd.client.packets_sent:1|c|#client:java,client_version:4.4.3,client_transport:udp
datadog.dogstatsd.client.packets_dropped:0|c|#client:java,client_version:4.4.3,client_transport:udp
datadog.dogstatsd.client.packets_dropped_queue:0|c|#client:java,client_version:4.4.3,client_transport:udp
datadog.dogstatsd.client.aggregated_context:0|c|#client:java,client_version:4.4.3,client_transport:udp
datadog.dogstatsd.client.metrics_by_type:0|c|#client:java,client_version:4.4.3,client_transport:udp,metrics_type:gauge
datadog.dogstatsd.client.metrics_by_type:1|c|#client:java,client_version:4.4.3,client_transport:udp,metrics_type:count
datadog.dogstatsd.client.metrics_by_type:0|c|#client:java,client_version:4.4.3,client_transport:udp,metrics_type:set
datadog.dogstatsd.client.metrics_by_type:0|c|#client:java,client_version:4.4.3,client_transport:udp,metrics_type:histogram

23:54:39.746139 IP localhost.58535 > localhost.8125: UDP, length 514
E.......@................
..datadog.dogstatsd.client.metrics_by_type:0|c|#client:java,client_version:4.4.3,client_transport:udp,metrics_type:distribution
datadog.dogstatsd.client.aggregated_context_by_type:0|c|#client:java,client_version:4.4.3,client_transport:udp,metrics_type:gauge
datadog.dogstatsd.client.aggregated_context_by_type:0|c|#client:java,client_version:4.4.3,client_transport:udp,metrics_type:count
datadog.dogstatsd.client.aggregated_context_by_type:0|c|#client:java,client_version:4.4.3,client_transport:udp,metrics_type:set

23:54:41.744070 IP localhost.58535 > localhost.8125: UDP, length 22
E..2....@..................1prefix.my.counter:1|c
...
```

Or if I use `ncat` with `-k` option for multiple UDP clients support, I also could see metrics from both the `NonBlockingStatsDClient` and the `StatsdMeterRegistry` as follows:

```
% ncat -k -ulp 8125
prefix.my.counter:1|c
logback.events:1|c|#statistic:count,level:info
jvm.gc.pause:1|ms|#action:end of minor GC,cause:collect due to normal GC activity,gc:scavenge
jvm.gc.memory.allocated:7298624|c|#statistic:count
logback.events:1|c|#statistic:count,level:info
jvm.buffer.memory.used:749717|g|#statistic:value,id:direct
jvm.threads.states:0|g|#statistic:value,state:blocked
jvm.memory.max:429391872|g|#statistic:value,area:heap,id:tenured-LOA
jvm.memory.used:7422768|g|#statistic:value,area:nonheap,id:JIT code cache
jvm.memory.committed:31938560|g|#statistic:value,area:heap,id:tenured-SOA
jvm.memory.max:-1|g|#statistic:value,area:nonheap,id:class storage
jvm.memory.used:2031616|g|#statistic:value,area:heap,id:nursery-survivor
process.uptime:11978|g|#statistic:value
jvm.threads.states:37|g|#statistic:value,state:runnable
system.load.average.1m:4.22168|g|#statistic:value
jvm.memory.used:4194304|g|#statistic:value,area:nonheap,id:JIT data cache
jvm.info:1|g|#statistic:value,runtime:IBM Semeru Runtime Open Edition,vendor:Eclipse OpenJ9,version:17.0.4.1-ea+1
jvm.memory.max:1519446016|g|#statistic:value,area:heap,id:nursery-allocate
tomcat.sessions.active.current:0|g|#statistic:value
disk.total:494384795648|g|#statistic:value,path:/Users/user/IdeaProjects/hello-spring-boot-micrometer/.
executor.queue.remaining:2147483647|g|#statistic:value,name:applicationTaskExecutor
jvm.buffer.total.capacity:749716|g|#statistic:value,id:direct
jvm.gc.pause:6|ms|#action:end of major GC,cause:collect due to normal GC activity,gc:global
jvm.gc.memory.allocated:140664|c|#statistic:count
executor.pool.size:0|g|#statistic:value,name:applicationTaskExecutor
jvm.memory.max:402653184|g|#statistic:value,area:nonheap,id:JIT data cache
jvm.memory.used:28404176|g|#statistic:value,area:heap,id:tenured-SOA
system.cpu.usage:-1|g|#statistic:value
jvm.threads.live:59|g|#statistic:value
jvm.classes.unloaded:3|c|#statistic:count
jvm.memory.committed:316325884|g|#statistic:value,area:nonheap,id:miscellaneous non-heap storage
jvm.memory.committed:268435456|g|#statistic:value,area:nonheap,id:JIT code cache
jvm.classes.loaded:10001|g|#statistic:value
jvm.threads.peak:59|g|#statistic:value
jvm.memory.committed:4718592|g|#statistic:value,area:nonheap,id:JIT data cache
process.cpu.time:4204798000|c|#statistic:count
jvm.memory.used:2234680|g|#statistic:value,area:heap,id:nursery-allocate
jvm.gc.overhead:0.000926|g|#statistic:value
application.started.time:2030|g|#statistic:value,main.application.class:com.izeye.helloworld.springbootmicrometer.HelloSpringBootMicrometerApplication
tomcat.sessions.rejected:0|c|#statistic:count
tomcat.sessions.alive.max:0|g|#statistic:value
jvm.memory.max:268435456|g|#statistic:value,area:nonheap,id:JIT code cache
jvm.memory.max:-1|g|#statistic:value,area:nonheap,id:miscellaneous non-heap storage
jvm.threads.started:62|c|#statistic:count
jvm.threads.states:11|g|#statistic:value,state:waiting
executor.completed:0|c|#statistic:count,name:applicationTaskExecutor
jvm.buffer.count:0|g|#statistic:value,id:mapped
executor.pool.max:2147483647|g|#statistic:value,name:applicationTaskExecutor
jvm.memory.committed:351112384|g|#statistic:value,area:nonheap,id:class storage
jvm.memory.used:59557536|g|#statistic:value,area:nonheap,id:miscellaneous non-heap storage
jvm.memory.usage.after.gc:0.040144|g|#statistic:value,area:heap,pool:long-lived
tomcat.sessions.expired:0|c|#statistic:count
tomcat.sessions.created:0|c|#statistic:count
jvm.memory.committed:2028544|g|#statistic:value,area:heap,id:tenured-LOA
jvm.memory.committed:4915200|g|#statistic:value,area:heap,id:nursery-allocate
jvm.gc.max.data.size:1519446015|g|#statistic:value
jvm.buffer.total.capacity:0|g|#statistic:value,id:mapped
system.cpu.count:10|g|#statistic:value
jvm.memory.max:8158445568|g|#statistic:value,area:heap,id:tenured-SOA
executor.pool.core:8|g|#statistic:value,name:applicationTaskExecutor
process.start.time:1735397715695|g|#statistic:value
jvm.buffer.count:523|g|#statistic:value,id:direct
jvm.buffer.memory.used:0|g|#statistic:value,id:mapped
jvm.memory.committed:2031616|g|#statistic:value,area:heap,id:nursery-survivor
datadog.dogstatsd.client.metrics:1|c|#client:java,client_version:4.4.3,client_transport:udp
datadog.dogstatsd.client.events:0|c|#client:java,client_version:4.4.3,client_transport:udp
datadog.dogstatsd.client.service_checks:0|c|#client:java,client_version:4.4.3,client_transport:udp
datadog.dogstatsd.client.bytes_sent:22|c|#client:java,client_version:4.4.3,client_transport:udp
datadog.dogstatsd.client.bytes_dropped:0|c|#client:java,client_version:4.4.3,client_transport:udp
datadog.dogstatsd.client.packets_sent:1|c|#client:java,client_version:4.4.3,client_transport:udp
datadog.dogstatsd.client.packets_dropped:0|c|#client:java,client_version:4.4.3,client_transport:udp
datadog.dogstatsd.client.packets_dropped_queue:0|c|#client:java,client_version:4.4.3,client_transport:udp
datadog.dogstatsd.client.aggregated_context:0|c|#client:java,client_version:4.4.3,client_transport:udp
datadog.dogstatsd.client.metrics_by_type:0|c|#client:java,client_version:4.4.3,client_transport:udp,metrics_type:gauge
datadog.dogstatsd.client.metrics_by_type:1|c|#client:java,client_version:4.4.3,client_transport:udp,metrics_type:count
datadog.dogstatsd.client.metrics_by_type:0|c|#client:java,client_version:4.4.3,client_transport:udp,metrics_type:set
datadog.dogstatsd.client.metrics_by_type:0|c|#client:java,client_version:4.4.3,client_transport:udp,metrics_type:histogram
datadog.dogstatsd.client.metrics_by_type:0|c|#client:java,client_version:4.4.3,client_transport:udp,metrics_type:distribution
datadog.dogstatsd.client.aggregated_context_by_type:0|c|#client:java,client_version:4.4.3,client_transport:udp,metrics_type:gauge
datadog.dogstatsd.client.aggregated_context_by_type:0|c|#client:java,client_version:4.4.3,client_transport:udp,metrics_type:count
datadog.dogstatsd.client.aggregated_context_by_type:0|c|#client:java,client_version:4.4.3,client_transport:udp,metrics_type:set
prefix.my.counter:1|c
```

So the problem seems to be due to the `netcat` that doesn't support multiple UDP clients.

**Comment by spachari-im** [comment]
@izeye Yes. It looks like the problem is with netcat on MacOS. We can close this ticket. Thank you for helping.
